{
  "component_schema_version": "1.0.0",
  "manifest_id": "sub123_spand_rahasya",
  "identity": {
    "category_code": "CAT001",
    "subject_code": "SUB123",
    "title_slug": "spand-rahasya"
  },
  "artifact_root": "library/spand",
  "profile_overrides": {
    "proofreading": "gemini-3.6-flash-v1",
    "chunking": "bge-m3-semantic-window-v1"
  },
  "editions": {
    "hi-IN": {
      "release": {
        "version": "01",
        "subversion": "02"
      },
      "source_document": {
        "relative_path": "123_spand/unicode/hi-IN.docx",
        "font_encoding": "unicode",
        "file_format": "docx"
      },
      "chapter_split": {
        "enabled": true,
        "pattern_type": "regex",
        "pattern": "^प्रबोधन",
        "flags": [
          "MULTILINE"
        ]
      },
      "profile_overrides": {
        "proofreading": "example-proofreading-v2"
      }
    },
    "mr-IN": {
      "release": {
        "version": "03",
        "subversion": "01"
      },
      "source_document": {
        "relative_path": "123_spand/unicode/mr-IN.docx",
        "font_encoding": "unicode",
        "file_format": "docx"
      },
      "chapter_split": {
        "enabled": false
      }
    }
  }
}
